,videoId,textDisplay,textOriginal,authorDisplayName,authorProfileImageUrl,authorChannelUrl,authorChannelId,canRate,viewerRating,likeCount,publishedAt,updatedAt,parentId,timestamp
231,DtxWm-IYqEU,Nareszcie!!!!! 💖💖💖💖 Pół Polski na to czekało. Wielkie dzięki.,Nareszcie!!!!! 💖💖💖💖 Pół Polski na to czekało. Wielkie dzięki.,Lubię Góry,https://yt3.ggpht.com/ytc/AMLnZu_kKBLo4qQMnhyFBBX3bQbSAEdaoey6eIa1G3fsOQ=s48-c-k-c0x00ffffff-no-rj,http://www.youtube.com/channel/UCuVC15wP44zXhDi7e3dMNew,{'value': 'UCuVC15wP44zXhDi7e3dMNew'},True,none,9,2022-05-07T18:58:37Z,2022-05-07T18:58:37Z,,1651949917
232,DtxWm-IYqEU,"&quot;A gdyby tak orły wzięły pierścień i...? A dobra, nieważne&quot; Bardzo dobrze to ująłeś","""A gdyby tak orły wzięły pierścień i...? A dobra, nieważne"" Bardzo dobrze to ująłeś",Piotr M,https://yt3.ggpht.com/ytc/AMLnZu_jjRe5G1_FyWg60DWiGch27q4m5G4F3SXtWySmAA=s48-c-k-c0x00ffffff-no-rj,http://www.youtube.com/channel/UCqA4ee6Pg6AybIuS5q3eJgg,{'value': 'UCqA4ee6Pg6AybIuS5q3eJgg'},True,none,51,2022-05-07T18:55:59Z,2022-05-07T18:55:59Z,,1651949759
233,DtxWm-IYqEU,Może zrobisz szyderczy skrót Moon Knighta🌙?,Może zrobisz szyderczy skrót Moon Knighta🌙?,Akali that girl,https://yt3.ggpht.com/ytc/AMLnZu88NrArXCH6zbAOx_TjiLQyR2B-GhQyyHp-6k1GsA=s48-c-k-c0x00ffffff-no-rj,http://www.youtube.com/channel/UC2yCuYLrqhJQhwwxdnBTrpg,{'value': 'UC2yCuYLrqhJQhwwxdnBTrpg'},True,none,0,2022-05-07T18:55:40Z,2022-05-07T18:55:40Z,,1651949740
234,DtxWm-IYqEU,Cudeńko 🤩😆,Cudeńko 🤩😆,Timothy P.,https://yt3.ggpht.com/ytc/AMLnZu_uzITZ_JT-HHjzDBZafzjdiphyq1tSYGlHexMJcQ=s48-c-k-c0x00ffffff-no-rj,http://www.youtube.com/channel/UCClYaqsJ-S-WIgt9LtzvTwg,{'value': 'UCClYaqsJ-S-WIgt9LtzvTwg'},True,none,1,2022-05-07T18:53:58Z,2022-05-07T18:53:58Z,,1651949638
235,DtxWm-IYqEU,Teraz kolej na Rockyego lub Rambo😀,Teraz kolej na Rockyego lub Rambo😀,Paweł Góra,https://yt3.ggpht.com/ytc/AMLnZu8MPxJgZusFirMqxCryc6pc_woElaad3GX-y0p8VzhaKK3v8MvWQgj_ut0XbEQo=s48-c-k-c0x00ffffff-no-rj,http://www.youtube.com/channel/UC3dGluewQ8gzr6Ele1xk9Vg,{'value': 'UC3dGluewQ8gzr6Ele1xk9Vg'},True,none,0,2022-05-07T18:49:24Z,2022-05-07T18:49:24Z,,1651949364
236,DtxWm-IYqEU,"&quot;Złota myśl napisana czarną mową&quot; czekałam długo na ten szyderczy skrót, ale się nie zawiodłam ;)","""Złota myśl napisana czarną mową"" czekałam długo na ten szyderczy skrót, ale się nie zawiodłam ;)",Magda Lena,https://yt3.ggpht.com/t6-OgH6IyqA5q-j51f4LA4tIhemci-HocTAbIh1mk_7Rsrq-8x9FUg79hIQPNItmU7dNyhje4g=s48-c-k-c0x00ffffff-no-rj,http://www.youtube.com/channel/UCaqEsbsb6DuoVXb3rQWGo9A,{'value': 'UCaqEsbsb6DuoVXb3rQWGo9A'},True,none,3,2022-05-07T18:46:14Z,2022-05-07T18:46:14Z,,1651949174
237,DtxWm-IYqEU,Karakany i pyrtki - nowe określenie na hobbitów. Czekam na kolejne części + Hobbita,Karakany i pyrtki - nowe określenie na hobbitów. Czekam na kolejne części + Hobbita,Nadia Smolarkiewicz,https://yt3.ggpht.com/ytc/AMLnZu_-bG4uq67msZdxEo9PhZHPqSp_d10PpGq8u6oD=s48-c-k-c0x00ffffff-no-rj,http://www.youtube.com/channel/UCsBLE6Sp-N-fM_GuNn3_nMQ,{'value': 'UCsBLE6Sp-N-fM_GuNn3_nMQ'},True,none,6,2022-05-07T18:44:16Z,2022-05-07T18:44:16Z,,1651949056
238,DtxWm-IYqEU,czekalem na to rok,czekalem na to rok,Sylwek Kudaj,https://yt3.ggpht.com/FoFPkrAvXD4bLgDrFKoAbsjdvUteQby-7kMo5kiox_oy45N0garJ7nYsyGY2PeUBPN5yGocbYQ=s48-c-k-c0x00ffffff-no-rj,http://www.youtube.com/channel/UC6kaliItmS4r9QjyVcGxI2w,{'value': 'UC6kaliItmS4r9QjyVcGxI2w'},True,none,0,2022-05-07T18:42:47Z,2022-05-07T18:42:47Z,,1651948967
239,DtxWm-IYqEU,No wracam na kanał bo wkoncu coś innego niż ten zjebany spiderman,No wracam na kanał bo wkoncu coś innego niż ten zjebany spiderman,Mich uu,https://yt3.ggpht.com/ytc/AMLnZu9oF4noTrUf_-xRSGmZwkAaUnwXVDDUgFpkyrZd=s48-c-k-c0x00ffffff-no-rj,http://www.youtube.com/channel/UCMCLPGwxaCxiF3yW5uglWzg,{'value': 'UCMCLPGwxaCxiF3yW5uglWzg'},True,none,0,2022-05-07T18:41:58Z,2022-05-07T18:41:58Z,,1651948918
240,DtxWm-IYqEU,"Miniaturka nie przekonuje ale wiedziałem, że jak zawsze będzie zayebyste.","Miniaturka nie przekonuje ale wiedziałem, że jak zawsze będzie zayebyste.",Help Bank,https://yt3.ggpht.com/ytc/AMLnZu_IuVnaXc7o0tafbWNnRInvQ0RGS0d2pH4I5w=s48-c-k-c0x00ffffff-no-rj,http://www.youtube.com/channel/UCWixfX_W9T1G_fjE7Ie-N4A,{'value': 'UCWixfX_W9T1G_fjE7Ie-N4A'},True,none,0,2022-05-07T18:38:44Z,2022-05-07T18:38:44Z,,1651948724
241,DtxWm-IYqEU,Bardzo fajne są te odniesienia do kilku albo kilkunastu godzinnego wyjaśniania niektórych bardzo ważnych wątków.,Bardzo fajne są te odniesienia do kilku albo kilkunastu godzinnego wyjaśniania niektórych bardzo ważnych wątków.,Szymon Brom,https://yt3.ggpht.com/ytc/AMLnZu-FbEyUPpnHQCvSMh9sRwH8BqROMFim-Ngvcw=s48-c-k-c0x00ffffff-no-rj,http://www.youtube.com/channel/UC67zXxnsfwBVl_wewrBRbYw,{'value': 'UC67zXxnsfwBVl_wewrBRbYw'},True,none,0,2022-05-07T18:33:42Z,2022-05-07T18:33:42Z,,1651948422
242,DtxWm-IYqEU,Ale dwie kolejne części tez będą:),Ale dwie kolejne części tez będą:),shadow,https://yt3.ggpht.com/r0ToXPceK5xU3EYNFV5MlFub7agXB_limaKKCDLtYcg1zXEiUDEXbVxKu3g6HZBF5fIq6mggwA=s48-c-k-c0x00ffffff-no-rj,http://www.youtube.com/channel/UC8dwOhUPR_T8SiexM1Dewdg,{'value': 'UC8dwOhUPR_T8SiexM1Dewdg'},True,none,1,2022-05-07T18:33:33Z,2022-05-07T18:33:33Z,,1651948413
243,DtxWm-IYqEU,Subik wpadł oglądałem wszystkie odcinki ale to jest mistrzostwo🍿❤❤❤,Subik wpadł oglądałem wszystkie odcinki ale to jest mistrzostwo🍿❤❤❤,ww,https://yt3.ggpht.com/ytc/AMLnZu84gaN4_6AHafXFq6HUQJ7XLWEu4wj8VJBfUQ=s48-c-k-c0x00ffffff-no-rj,http://www.youtube.com/channel/UCv2x_rNy90RkmGaelKYYdMg,{'value': 'UCv2x_rNy90RkmGaelKYYdMg'},True,none,0,2022-05-07T18:33:08Z,2022-05-07T18:33:08Z,,1651948388
244,DtxWm-IYqEU,"Ale Bilbo był wujem Froda a nie kuzynem...<br>ALE I TAK ZAJEBIŚCIE CI FILM WYSZEDŁ, ZRESZTĄ JAK ZWYTKLE!","Ale Bilbo był wujem Froda a nie kuzynem...
ALE I TAK ZAJEBIŚCIE CI FILM WYSZEDŁ, ZRESZTĄ JAK ZWYTKLE!",Aulis 230,https://yt3.ggpht.com/bK_ZGwR4VWMfjnrmkfNbURLyTlGA0MVrPvgYy6l58Axq_UkRhzPXz5aPAiPq7U76EDawDTeFSSo=s48-c-k-c0x00ffffff-no-rj,http://www.youtube.com/channel/UCTv_eVTtcmx4EavXu_cRY1w,{'value': 'UCTv_eVTtcmx4EavXu_cRY1w'},True,none,2,2022-05-07T18:32:40Z,2022-05-07T18:32:40Z,,1651948360
245,DtxWm-IYqEU,Pierścień saurona musi być kobietą,Pierścień saurona musi być kobietą,Jahwe Abdulin,https://yt3.ggpht.com/ytc/AMLnZu9L4FfwJ1UqQlD2S_PBDp5tquN9KUDc185ZBw=s48-c-k-c0x00ffffff-no-rj,http://www.youtube.com/channel/UC-rvBIpxFsxVR0MVBfGPpbA,{'value': 'UC-rvBIpxFsxVR0MVBfGPpbA'},True,none,1,2022-05-07T18:29:20Z,2022-05-07T18:29:20Z,,1651948160
246,DtxWm-IYqEU,No fakt prequele są gorsze ale mimo wszystko zajebiste (moim skromnym zdaniem).,No fakt prequele są gorsze ale mimo wszystko zajebiste (moim skromnym zdaniem).,Szymon Brom,https://yt3.ggpht.com/ytc/AMLnZu-FbEyUPpnHQCvSMh9sRwH8BqROMFim-Ngvcw=s48-c-k-c0x00ffffff-no-rj,http://www.youtube.com/channel/UC67zXxnsfwBVl_wewrBRbYw,{'value': 'UC67zXxnsfwBVl_wewrBRbYw'},True,none,0,2022-05-07T18:28:22Z,2022-05-07T18:28:22Z,,1651948102
247,DtxWm-IYqEU,Nikt nie prosił <br>Każdy czekał,"Nikt nie prosił 
Każdy czekał",XkwasuX,https://yt3.ggpht.com/ytc/AMLnZu_iCo6T0t00IK3qdQ-Wm4_fbLu6HalAEYAE5mMNzw=s48-c-k-c0x00ffffff-no-rj,http://www.youtube.com/channel/UCylQaf1a0hox7KSDWU1_XBg,{'value': 'UCylQaf1a0hox7KSDWU1_XBg'},True,none,1,2022-05-07T18:25:34Z,2022-05-07T18:25:34Z,,1651947934
248,DtxWm-IYqEU,Moja ulubiona książkowa trylogia :D,Moja ulubiona książkowa trylogia :D,creeperek gry,https://yt3.ggpht.com/ytc/AMLnZu8DSh0bd8tsVRF8YY8LrOlrZhlA6hrLzU5RnJipPA=s48-c-k-c0x00ffffff-no-rj,http://www.youtube.com/channel/UCMylC_HoFRmuqDoYVhpHryg,{'value': 'UCMylC_HoFRmuqDoYVhpHryg'},True,none,7,2022-05-07T18:22:28Z,2022-05-07T18:22:28Z,,1651947748
249,DtxWm-IYqEU,Zraniles mnie to mój ulubiony film i pisarz jak możesz tak brzydko muwic,Zraniles mnie to mój ulubiony film i pisarz jak możesz tak brzydko muwic,Milena Curylo,https://yt3.ggpht.com/ytc/AMLnZu_qCUfh99ZwQhFwim4YbkAg-bNVsq7Zsn7KBg=s48-c-k-c0x00ffffff-no-rj,http://www.youtube.com/channel/UC0TCgn6ldg3b68giR30mdWw,{'value': 'UC0TCgn6ldg3b68giR30mdWw'},True,none,0,2022-05-07T18:22:11Z,2022-05-07T18:22:11Z,,1651947731
250,DtxWm-IYqEU,nareszcie inny film,nareszcie inny film,Małgorzata,https://yt3.ggpht.com/T07Q0r38ipvxOby4YZF1NblVCeu2gwixGTlfrTyaWniJUChtJIvO7rbQYpK8uKKwGWfj2M-8_Q=s48-c-k-c0x00ffffff-no-rj,http://www.youtube.com/channel/UC0AmsrAm_lkC-sYD6Yeakmw,{'value': 'UC0AmsrAm_lkC-sYD6Yeakmw'},True,none,0,2022-05-07T18:19:24Z,2022-05-07T18:19:24Z,,1651947564
251,DtxWm-IYqEU,Wreszcie! Dziękuję ci błogosławiony Łukaszu,Wreszcie! Dziękuję ci błogosławiony Łukaszu,Ryder,https://yt3.ggpht.com/RmJEcDJcbJZxBmq9UlZOkX6qS58_-hTOposIfzeQM3fNDfWCMiKo_QIZc3bYlWzj3zRuQUjPfA=s48-c-k-c0x00ffffff-no-rj,http://www.youtube.com/channel/UCRAA6uGWfzMtkcEXF2S5nMg,{'value': 'UCRAA6uGWfzMtkcEXF2S5nMg'},True,none,1,2022-05-07T18:14:44Z,2022-05-07T18:14:44Z,,1651947284
252,DtxWm-IYqEU,"Jezus... Boże... to się stało... dziękuje ci Boże, kurwa jest w pytę","Jezus... Boże... to się stało... dziękuje ci Boże, kurwa jest w pytę",Ori,https://yt3.ggpht.com/ytc/AMLnZu9v8oucWpanW_z0DiIUuh40uOANGUT4xH-f_1sK=s48-c-k-c0x00ffffff-no-rj,http://www.youtube.com/channel/UCUaEYkyPuYy2UPfRrGOAlsw,{'value': 'UCUaEYkyPuYy2UPfRrGOAlsw'},True,none,1,2022-05-07T18:14:37Z,2022-05-07T18:14:37Z,,1651947277
253,DtxWm-IYqEU,"To uczucie, gdy głupia reklama gry w wykonaniu Cegiełki jest tak dobra, że jej nawet nie pomijasz. Leci sub.","To uczucie, gdy głupia reklama gry w wykonaniu Cegiełki jest tak dobra, że jej nawet nie pomijasz. Leci sub.",Shevyjra,https://yt3.ggpht.com/tZAuSUubvQpNEqQ9sjNwUrXrMWHsaeHHgOxmEux-Q9W1uqXTe5q9lYLya5sd1yte5A9DjartGw=s48-c-k-c0x00ffffff-no-rj,http://www.youtube.com/channel/UCv2WeAW91LBgfLVe1uYNydQ,{'value': 'UCv2WeAW91LBgfLVe1uYNydQ'},True,none,0,2022-05-07T18:12:55Z,2022-05-07T18:12:55Z,,1651947175
254,DtxWm-IYqEU,Ejjj a gdzie ocena? To oglądam cały odcinek żeby się dowiedzieć a tu ni ma?! <br>Doprawdy...,"Ejjj a gdzie ocena? To oglądam cały odcinek żeby się dowiedzieć a tu ni ma?! 
Doprawdy...",Marzena Mikołajczyk,https://yt3.ggpht.com/ytc/AMLnZu_AB7SEmExnsuv7j7vLm15WqrZ1XpFYeyLNLw=s48-c-k-c0x00ffffff-no-rj,http://www.youtube.com/channel/UC80uTV3ezbOa7bRoMvda-AA,{'value': 'UC80uTV3ezbOa7bRoMvda-AA'},True,none,0,2022-05-07T18:03:48Z,2022-05-07T18:03:48Z,,1651946628
255,DtxWm-IYqEU,"kolejny super odcinek, może pacific rim następnym razem?","kolejny super odcinek, może pacific rim następnym razem?",quon,https://yt3.ggpht.com/ytc/AMLnZu8SZgPd5DltbdSYxVYgsQhkgNfFXeHZYxc_AQpLSZGWKHBqlc7Anh3Mbfu8Hfnp=s48-c-k-c0x00ffffff-no-rj,http://www.youtube.com/channel/UCfV-Htl0F0S8T2aSWRSJgVg,{'value': 'UCfV-Htl0F0S8T2aSWRSJgVg'},True,none,0,2022-05-07T18:02:49Z,2022-05-07T18:02:49Z,,1651946569
256,DtxWm-IYqEU,Już więcej dawały pierscienie kapitana planety :),Już więcej dawały pierscienie kapitana planety :),Pawel Dzk,https://yt3.ggpht.com/ytc/AMLnZu-50VHvr-jcrl923cpSC_t6T4f9rrpDMFvA6DT5xQw3anDDGgL0EAZYHWcFAEyy=s48-c-k-c0x00ffffff-no-rj,http://www.youtube.com/channel/UC7cJ6CU8KH0m723XrdtQhKw,{'value': 'UC7cJ6CU8KH0m723XrdtQhKw'},True,none,0,2022-05-07T17:55:44Z,2022-05-07T17:55:44Z,,1651946144
257,DtxWm-IYqEU,"No nie samowitą moc mu daje ten pierścień jak ciągle w łeb dostaje, filmy mogą być ale sama fabuła i historia to lipa na maxa.","No nie samowitą moc mu daje ten pierścień jak ciągle w łeb dostaje, filmy mogą być ale sama fabuła i historia to lipa na maxa.",Pawel Dzk,https://yt3.ggpht.com/ytc/AMLnZu-50VHvr-jcrl923cpSC_t6T4f9rrpDMFvA6DT5xQw3anDDGgL0EAZYHWcFAEyy=s48-c-k-c0x00ffffff-no-rj,http://www.youtube.com/channel/UC7cJ6CU8KH0m723XrdtQhKw,{'value': 'UC7cJ6CU8KH0m723XrdtQhKw'},True,none,1,2022-05-07T17:55:14Z,2022-05-07T17:55:14Z,,1651946114
258,DtxWm-IYqEU,...,...,Siman,https://yt3.ggpht.com/ytc/AMLnZu9DQutmest6UkEdc0F5WCFjFuFt4AF-98LtiUJD=s48-c-k-c0x00ffffff-no-rj,http://www.youtube.com/channel/UCZh0KqYhPgdLj3VAYKFawkw,{'value': 'UCZh0KqYhPgdLj3VAYKFawkw'},True,none,0,2022-05-07T17:51:39Z,2022-05-07T17:51:39Z,,1651945899
259,DtxWm-IYqEU,Trylogia &quot;Hobbit&quot; nie była zła,"Trylogia ""Hobbit"" nie była zła",Nocny Łowca,https://yt3.ggpht.com/ytc/AMLnZu9q1RgmGrEyQzcaQmu9jnrJisM0P01rcZyZFPXy=s48-c-k-c0x00ffffff-no-rj,http://www.youtube.com/channel/UCMYWGk6eIgMNoSfFx3WImdg,{'value': 'UCMYWGk6eIgMNoSfFx3WImdg'},True,none,1,2022-05-07T17:45:57Z,2022-05-07T17:45:57Z,,1651945557
260,DtxWm-IYqEU,"Gdyby pofrunęli na orłach do Mordoru zamiast zapierdalać na piechotę, film trwałby krócej niż ten szyderczy skrót.","Gdyby pofrunęli na orłach do Mordoru zamiast zapierdalać na piechotę, film trwałby krócej niż ten szyderczy skrót.",zenek pipka45,https://yt3.ggpht.com/ytc/AMLnZu9o7uWoet3mNx1oRDpXWRWl6YZWemDNdz2VZ1bHAp1KA52ba-QZrwPJLuRu2EST=s48-c-k-c0x00ffffff-no-rj,http://www.youtube.com/channel/UCK-32FPHc0F13uhHYgt6iUg,{'value': 'UCK-32FPHc0F13uhHYgt6iUg'},True,none,3,2022-05-07T17:44:27Z,2022-05-07T17:44:27Z,,1651945467
261,DtxWm-IYqEU,ta gra to gówno,ta gra to gówno,Animerios Czerski,https://yt3.ggpht.com/ytc/AMLnZu9NZ54LG4XJRkMTAA9I7OJbaLYGMRyW5Sxejw=s48-c-k-c0x00ffffff-no-rj,http://www.youtube.com/channel/UCaj9jlXqLCZoAJpwHwL5B-w,{'value': 'UCaj9jlXqLCZoAJpwHwL5B-w'},True,none,0,2022-05-07T17:38:44Z,2022-05-07T17:38:44Z,,1651945124
262,DtxWm-IYqEU,Mój ulubiony film dzięki pozdro ;),Mój ulubiony film dzięki pozdro ;),Max B,https://yt3.ggpht.com/ytc/AMLnZu-QMXoICPQGtvjmONz5pA9LK7YENdm48XEybhyq=s48-c-k-c0x00ffffff-no-rj,http://www.youtube.com/channel/UC-o0xvWkY551qjs_GB_lOlg,{'value': 'UC-o0xvWkY551qjs_GB_lOlg'},True,none,6,2022-05-07T17:37:07Z,2022-05-07T17:37:07Z,,1651945027
263,DtxWm-IYqEU,WY!!!!!!!PIER!!!!!!!!!!!!DALAJ!!!!!!!!!!!!!!!!       ^-^,WY!!!!!!!PIER!!!!!!!!!!!!DALAJ!!!!!!!!!!!!!!!!       ^-^,DarkSeidHecOminGforyOu,https://yt3.ggpht.com/w1eOEyLPqmuFVr5vUceiXlgq061Ls5Q7l9lmDvt8dv8ZiQ9v4mL5GIbHRMkSFzFsZGVy7mJ0iY8=s48-c-k-c0x00ffffff-no-rj,http://www.youtube.com/channel/UCbhSphDNKHF-GS0IGi2rL1A,{'value': 'UCbhSphDNKHF-GS0IGi2rL1A'},True,none,0,2022-05-07T17:35:36Z,2022-05-07T17:35:36Z,,1651944936
264,DtxWm-IYqEU,Ej dawaj zrób szyderczy skrót shang hi i legenda 10 pierścieni,Ej dawaj zrób szyderczy skrót shang hi i legenda 10 pierścieni,SPOCONA PARÓWA 2137,https://yt3.ggpht.com/GpqP9zRrqd5uC-jzFY7jhyV3wzhMyKN1Kh-n4TCmvqAPgIb_yLAcbfCzciW1bShYTGU2QHHT5Q=s48-c-k-c0x00ffffff-no-rj,http://www.youtube.com/channel/UChbVC6G0OJKx31Z6JhX4BBA,{'value': 'UChbVC6G0OJKx31Z6JhX4BBA'},True,none,0,2022-05-07T17:35:13Z,2022-05-07T17:35:13Z,,1651944913
265,DtxWm-IYqEU,Zrobisz dr.strange 2???,Zrobisz dr.strange 2???,Karol Andruszkiewicz,https://yt3.ggpht.com/ytc/AMLnZu_Ei2IWHl0_2o8pCqpzZO6xTSr8_aRy5bViRQ6FNA=s48-c-k-c0x00ffffff-no-rj,http://www.youtube.com/channel/UC9XLlw-pprSfQXMFRiE5LCg,{'value': 'UC9XLlw-pprSfQXMFRiE5LCg'},True,none,2,2022-05-07T17:34:55Z,2022-05-07T17:34:55Z,,1651944895
266,DtxWm-IYqEU,"Będzie szyderczy skrót serialu amazona?(oczywiście, kiedy wyjdzie)oraz naszej (nie)ukochanej trylogii hobbita?","Będzie szyderczy skrót serialu amazona?(oczywiście, kiedy wyjdzie)oraz naszej (nie)ukochanej trylogii hobbita?",Wypychosiak,https://yt3.ggpht.com/IdKS7RZCYfC2lTegtKUk_Y80FPgDT69Azj6UPa9PR-WNffu0b2SZz28bsUylOYBzz8KpYHDbBxk=s48-c-k-c0x00ffffff-no-rj,http://www.youtube.com/channel/UC_K0Rtu7sYryBN6x8dW9iMw,{'value': 'UC_K0Rtu7sYryBN6x8dW9iMw'},True,none,0,2022-05-07T17:34:49Z,2022-05-07T17:34:49Z,,1651944889
267,DtxWm-IYqEU,To jest zamiatane,To jest zamiatane,Bozena Wojda,https://yt3.ggpht.com/ytc/AMLnZu-PKnAqZYTn9WAw5h12QXCphv1pZ00iMmm8zA=s48-c-k-c0x00ffffff-no-rj,http://www.youtube.com/channel/UCTXkAD7lxb0u6_8JR7VV-Hg,{'value': 'UCTXkAD7lxb0u6_8JR7VV-Hg'},True,none,0,2022-05-07T17:33:34Z,2022-05-07T17:33:34Z,,1651944814
268,DtxWm-IYqEU,To jest zamiatane,To jest zamiatane,Bozena Wojda,https://yt3.ggpht.com/ytc/AMLnZu-PKnAqZYTn9WAw5h12QXCphv1pZ00iMmm8zA=s48-c-k-c0x00ffffff-no-rj,http://www.youtube.com/channel/UCTXkAD7lxb0u6_8JR7VV-Hg,{'value': 'UCTXkAD7lxb0u6_8JR7VV-Hg'},True,none,0,2022-05-07T17:33:05Z,2022-05-07T17:33:05Z,,1651944785
269,DtxWm-IYqEU,"Wiele osób się dziwi czemu drużyna pierścienia po prostu nie poleciała na orłach do Mordoru, ALE...<br>Taki właśnie był plan Gandalfa, bo pierwotnie szli prosto do królestwa Orłów. Tuż przed tym jak Gandalf spadł w kopalnie powiedział słowa &quot;Fly you fools!&quot; co znaczy dosłownie &quot;lećcie głupcy!&quot;. Co miało zasugerować reszcie drużyny sposób dostania się do Mordoru. Jednak oni zrozumieli to opacznie i po prostu uciekli. W tą samą pułapkę jak widać wpadli zresztą tłumacze który przetłumaczyli to jako &quot;biegnijcie głupcy!&quot;.<br>Bo jeśli właśnie popatrzeć na mapę śródziemna z uniwersum Tolkiena to można zauważyć że Gandalf ich prowadził prościutko do królestwa orłów :) .","Wiele osób się dziwi czemu drużyna pierścienia po prostu nie poleciała na orłach do Mordoru, ALE...
Taki właśnie był plan Gandalfa, bo pierwotnie szli prosto do królestwa Orłów. Tuż przed tym jak Gandalf spadł w kopalnie powiedział słowa ""Fly you fools!"" co znaczy dosłownie ""lećcie głupcy!"". Co miało zasugerować reszcie drużyny sposób dostania się do Mordoru. Jednak oni zrozumieli to opacznie i po prostu uciekli. W tą samą pułapkę jak widać wpadli zresztą tłumacze który przetłumaczyli to jako ""biegnijcie głupcy!"".
Bo jeśli właśnie popatrzeć na mapę śródziemna z uniwersum Tolkiena to można zauważyć że Gandalf ich prowadził prościutko do królestwa orłów :) .",Fruti Fruti,https://yt3.ggpht.com/ytc/AMLnZu_FjmcHC2q7TfRkYPG9r_S2oNlqaiKSgl8eTg=s48-c-k-c0x00ffffff-no-rj,http://www.youtube.com/channel/UCYhw6L0Jh1huM0KVchehsXA,{'value': 'UCYhw6L0Jh1huM0KVchehsXA'},True,none,50,2022-05-07T17:32:49Z,2022-05-07T17:32:49Z,,1651944769
270,DtxWm-IYqEU,Kiedy człowiek w żelaznej masce?,Kiedy człowiek w żelaznej masce?,mulko shorts,https://yt3.ggpht.com/9NFtK1SDDChhRIO7zU3TS4J19DcRcQPdWjguK3qD0cd26s1ibRzMfKx0w2aFIDIbqKrIl1pj=s48-c-k-c0x00ffffff-no-rj,http://www.youtube.com/channel/UCdZJq7UC2BU9PWEl7dJ0t0Q,{'value': 'UCdZJq7UC2BU9PWEl7dJ0t0Q'},True,none,2,2022-05-07T17:30:38Z,2022-05-07T17:30:38Z,,1651944638
271,DtxWm-IYqEU,pienkne,pienkne,szklarek boxed you,https://yt3.ggpht.com/ytc/AMLnZu_qBLT3hHgl2y0ShX-ATnd50DRamPV4Cx_TBoWkTx2jyvnuGZ08K8O_5sb7kMig_Q=s48-c-k-c0x00ffffff-no-rj,http://www.youtube.com/channel/UCjZ7IxIWpAAZ7Bnex-g8jNQ,{'value': 'UCjZ7IxIWpAAZ7Bnex-g8jNQ'},True,none,0,2022-05-07T17:29:25Z,2022-05-07T17:29:25Z,,1651944565
272,DtxWm-IYqEU,"Ej no, dla mnie trylogia Hobbita była w pytę!","Ej no, dla mnie trylogia Hobbita była w pytę!",Morgan,https://yt3.ggpht.com/ytc/AMLnZu9_dj8ptNjc94xtqXf_HSBR5fBweQZ97ezD0gupxg=s48-c-k-c0x00ffffff-no-rj,http://www.youtube.com/channel/UCumxHTt8phZTWa2gl38aALQ,{'value': 'UCumxHTt8phZTWa2gl38aALQ'},True,none,1,2022-05-07T17:27:19Z,2022-05-07T17:27:19Z,,1651944439
273,DtxWm-IYqEU,"<a href=""https://www.youtube.com/watch?v=DtxWm-IYqEU&amp;t=15m40s"">15:40</a> nie, RYKO I KOKO HUJ CI W OKO.","15:40 nie, RYKO I KOKO HUJ CI W OKO.",KubiPROpl,https://yt3.ggpht.com/ytc/AMLnZu9ezOFwQXRg74cgdkLiwgZ3nRIF4gAAW_k-nnbMRcMWWxIcyEbLmkVKxBsNTCZr=s48-c-k-c0x00ffffff-no-rj,http://www.youtube.com/channel/UC4Bn88FON0bYfT8z1Q_0Mqg,{'value': 'UC4Bn88FON0bYfT8z1Q_0Mqg'},True,none,0,2022-05-07T17:26:52Z,2022-05-07T17:26:52Z,,1651944412
274,DtxWm-IYqEU,Uwielbiam Władcę Pierścieni ❤️,Uwielbiam Władcę Pierścieni ❤️,Julianna Sułkowska,https://yt3.ggpht.com/ytc/AMLnZu8xbCfRtqZ5mbE-88pyb-1vbOo6PC5EsCr_vMw2wKI5CKBFZmHq729k041v2h8F=s48-c-k-c0x00ffffff-no-rj,http://www.youtube.com/channel/UCztEex1k47SkVLaSoQ8amzA,{'value': 'UCztEex1k47SkVLaSoQ8amzA'},True,none,22,2022-05-07T17:22:43Z,2022-05-07T17:22:43Z,,1651944163
275,DtxWm-IYqEU,Doczekałam 🥰,Doczekałam 🥰,Niebieskozielona,https://yt3.ggpht.com/ytc/AMLnZu-ejXP32-mvTkZgyWWP5buJIilzPlLr6ISBLw=s48-c-k-c0x00ffffff-no-rj,http://www.youtube.com/channel/UCw5xJjvVmTLu990VA0DZLGw,{'value': 'UCw5xJjvVmTLu990VA0DZLGw'},True,none,0,2022-05-07T17:18:26Z,2022-05-07T17:18:26Z,,1651943906
276,DtxWm-IYqEU,"kiedy jestes taki chujowy w gry ze jedyne co mozesz reklamować to <a href=""https://www.youtube.com/watch?v=DtxWm-IYqEU&amp;t=00m18s"">00:18</a>",kiedy jestes taki chujowy w gry ze jedyne co mozesz reklamować to 00:18,Zdrowie,https://yt3.ggpht.com/ytc/AMLnZu_CoLrmVzncFlUE4R18wQMIdZ5ozxtxsdwjVU06skuUSgY8OPhgJ4RV3KaRVbBa=s48-c-k-c0x00ffffff-no-rj,http://www.youtube.com/channel/UCqJvQycTqd_bmt5-6M6VVfA,{'value': 'UCqJvQycTqd_bmt5-6M6VVfA'},True,none,0,2022-05-07T17:15:38Z,2022-05-07T17:15:38Z,,1651943738
277,DtxWm-IYqEU,Ten filmik bardziej mnie wciągnął niż oryginał 😁,Ten filmik bardziej mnie wciągnął niż oryginał 😁,Agnieszka Wojtasik,https://yt3.ggpht.com/ytc/AMLnZu-LGjjxuWQFiLDsXCf7Lq7EZHD9DVln5msEzg=s48-c-k-c0x00ffffff-no-rj,http://www.youtube.com/channel/UC0xqV8C-Zf3DUwV9LNRo2SQ,{'value': 'UC0xqV8C-Zf3DUwV9LNRo2SQ'},True,none,1,2022-05-07T17:07:42Z,2022-05-07T17:07:42Z,,1651943262
278,DtxWm-IYqEU,Jak zwykle dobra robota :&gt;  aczkolwiek od spotkania w Rivendell skrót wydaje się trochę zbyt pospieszony.,Jak zwykle dobra robota :>  aczkolwiek od spotkania w Rivendell skrót wydaje się trochę zbyt pospieszony.,Yogan Fumetsu,https://yt3.ggpht.com/ytc/AMLnZu_itwjSXe4QMshoAnYObRGoZx05QakBrXMIbdoKpg=s48-c-k-c0x00ffffff-no-rj,http://www.youtube.com/channel/UCV3KjkVR5y71CSV3PE1iKrw,{'value': 'UCV3KjkVR5y71CSV3PE1iKrw'},True,none,0,2022-05-07T17:06:28Z,2022-05-07T17:06:28Z,,1651943188
279,DtxWm-IYqEU,Nagrasz szyderczy skrót Slender Man?,Nagrasz szyderczy skrót Slender Man?,Ahsty,https://yt3.ggpht.com/2D_fGkMAKq8r00lT2WweWZRjNYDjuBUnq5yFuW7bR5yztSP8ZnQwj3OcS7NPb9ZA3Thar6BmRg=s48-c-k-c0x00ffffff-no-rj,http://www.youtube.com/channel/UCrQbFl7ajAgQsFDlCR0I5aA,{'value': 'UCrQbFl7ajAgQsFDlCR0I5aA'},True,none,2,2022-05-07T17:03:27Z,2022-05-07T17:03:27Z,,1651943007
280,DtxWm-IYqEU,"<a href=""https://www.youtube.com/watch?v=DtxWm-IYqEU&amp;t=9m16s"">9:16</a>  obejrzyj sobie G.F Darwin : Gandalf vs Orły",9:16  obejrzyj sobie G.F Darwin : Gandalf vs Orły,Damianos97,https://yt3.ggpht.com/ytc/AMLnZu8ymmAWovvJ0L2UnNKJBOGIsuEC33vXA3SVyw=s48-c-k-c0x00ffffff-no-rj,http://www.youtube.com/channel/UCbzwgb_3EbuJwOADmU2wsrA,{'value': 'UCbzwgb_3EbuJwOADmU2wsrA'},True,none,1,2022-05-07T17:03:18Z,2022-05-07T17:03:18Z,,1651942998
281,DtxWm-IYqEU,"jak to powiedział pewnien wojskowy: kolego, kupiłeś mnie tym jak paczkę żelków","jak to powiedział pewnien wojskowy: kolego, kupiłeś mnie tym jak paczkę żelków",Sean,https://yt3.ggpht.com/tt6ORKphZvzoztbUGqbsPQqMLcxcPf3UqgbV5fqS88VNb5Gp7h1T6UlqsrliUSCJ-X4cRy7Jc9s=s48-c-k-c0x00ffffff-no-rj,http://www.youtube.com/channel/UCIHf8iv5wjvK4QBU4Jbq82g,{'value': 'UCIHf8iv5wjvK4QBU4Jbq82g'},True,none,1,2022-05-07T17:02:23Z,2022-05-07T17:02:23Z,,1651942943
282,DtxWm-IYqEU,"<a href=""https://www.youtube.com/watch?v=DtxWm-IYqEU&amp;t=3m07s"">3:07</a> starczy jej na 6 albo 7 filmów .",3:07 starczy jej na 6 albo 7 filmów .,greg,https://yt3.ggpht.com/A-S3GvJatHwVlib_KuVBc7BcZmEN91Z9rcSoS-IS5au580uGyl54Iu_65RUCLIVBrsflyuqd8SA=s48-c-k-c0x00ffffff-no-rj,http://www.youtube.com/channel/UCJfiBYk7PaUWOZdJXosHP8g,{'value': 'UCJfiBYk7PaUWOZdJXosHP8g'},True,none,1,2022-05-07T17:02:08Z,2022-05-07T17:02:08Z,,1651942928
283,DtxWm-IYqEU,Czekam na całą trylogię,Czekam na całą trylogię,KH4N,https://yt3.ggpht.com/ytc/AMLnZu9mrlDLO41Mh8lpYYR0LJFm5vGGPWn95gaICYhW=s48-c-k-c0x00ffffff-no-rj,http://www.youtube.com/channel/UC4XwOrTFz5v-QVVNfQi23wA,{'value': 'UC4XwOrTFz5v-QVVNfQi23wA'},True,none,3,2022-05-07T16:57:51Z,2022-05-07T16:57:51Z,,1651942671
284,DtxWm-IYqEU,Wiedziałem że będzie mem ze Starkiem,Wiedziałem że będzie mem ze Starkiem,Lodzio ZM,https://yt3.ggpht.com/ytc/AMLnZu8KyZ-NqA2pdebke65kFkgS1Qj2vLzrZw1-rQ=s48-c-k-c0x00ffffff-no-rj,http://www.youtube.com/channel/UCY7AhQeEu0XtxeynE8GN6oA,{'value': 'UCY7AhQeEu0XtxeynE8GN6oA'},True,none,1,2022-05-07T16:57:00Z,2022-05-07T16:57:00Z,,1651942620
285,DtxWm-IYqEU,Hehe. Co pajeczaki się skończyły,Hehe. Co pajeczaki się skończyły,Joanna Góral,https://yt3.ggpht.com/ytc/AMLnZu9fP6HNlQ00BwVu-Rzsw0YP4Ihep3ck88kh0w=s48-c-k-c0x00ffffff-no-rj,http://www.youtube.com/channel/UCQ5pE2HghfRCurX9o2FImSQ,{'value': 'UCQ5pE2HghfRCurX9o2FImSQ'},True,none,1,2022-05-07T16:56:32Z,2022-05-07T16:56:32Z,,1651942592
286,DtxWm-IYqEU,3 dzień czekania na sonic szybki jak błyskawica,3 dzień czekania na sonic szybki jak błyskawica,stasiugames 1,https://yt3.ggpht.com/ytc/AMLnZu-71Apzer_m2K57gQ3DMOltOGgSi3ASpdcRIMvpgg=s48-c-k-c0x00ffffff-no-rj,http://www.youtube.com/channel/UCHExgcjbscb__BhejMEybxQ,{'value': 'UCHExgcjbscb__BhejMEybxQ'},True,none,0,2022-05-07T16:56:15Z,2022-05-07T16:56:15Z,,1651942575
287,DtxWm-IYqEU,Cegiełka może nagrasz i komentujesz Zombii Bobry super gówno,Cegiełka może nagrasz i komentujesz Zombii Bobry super gówno,Adrian Olejniczak,https://yt3.ggpht.com/ytc/AMLnZu-rnrC3auy3gfarOxe0W4nSsVpFPdFHJdkc8gNa36eQwGuq0rMyofu7O9-UW3pD=s48-c-k-c0x00ffffff-no-rj,http://www.youtube.com/channel/UCF34sr-daWH7T9PJJS2ho6A,{'value': 'UCF34sr-daWH7T9PJJS2ho6A'},True,none,0,2022-05-07T16:55:13Z,2022-05-07T16:55:13Z,,1651942513
288,DtxWm-IYqEU,Idealnie do kolacji,Idealnie do kolacji,Beata Sadowska,https://yt3.ggpht.com/ytc/AMLnZu8TyBa3UhR7YH7uAwHrKNXEHZ2ZCbEKjINQLYrsoRSEB0c7fRu57uup4Z3QRsPD=s48-c-k-c0x00ffffff-no-rj,http://www.youtube.com/channel/UCuc4GTq2MjUyl4YV6_33TfQ,{'value': 'UCuc4GTq2MjUyl4YV6_33TfQ'},True,none,0,2022-05-07T16:53:07Z,2022-05-07T16:53:07Z,,1651942387
